All patients had undergone breast-conserving surgery (BCS) and received adjuvant accelerated partial breast irradiation using interstitial fractionated multicatheter high-dose-rate brachytherapy.,breast irradiation;using;fractionated brachytherapy;adjuvant accelerated partial breast irradiation;using;fractionated multicatheter brachytherapy;accelerated partial breast irradiation;using;interstitial brachytherapy;accelerated breast irradiation;using;high-dose-rate brachytherapy;breast irradiation;using;interstitial fractionated multicatheter brachytherapy;adjuvant accelerated partial breast irradiation;using;interstitial fractionated multicatheter high-dose-rate brachytherapy;patients;received;breast irradiation;adjuvant partial breast irradiation;using;multicatheter high-dose-rate brachytherapy;accelerated partial breast irradiation;using;interstitial fractionated brachytherapy;accelerated partial breast irradiation;using;interstitial multicatheter brachytherapy;accelerated breast irradiation;using;fractionated high-dose-rate brachytherapy;adjuvant accelerated partial breast irradiation;using;multicatheter brachytherapy;partial breast irradiation;using;fractionated brachytherapy;accelerated breast irradiation;using;interstitial brachytherapy;adjuvant accelerated partial breast irradiation;using;interstitial fractionated brachytherapy;accelerated breast irradiation;using;fractionated brachytherapy;adjuvant accelerated breast irradiation;using;interstitial brachytherapy;adjuvant accelerated breast irradiation;using;interstitial multicatheter brachytherapy;breast irradiation;using;interstitial brachytherapy;adjuvant accelerated breast irradiation;using;fractionated brachytherapy;adjuvant accelerated breast irradiation;using;multicatheter high-dose-rate brachytherapy;adjuvant accelerated breast irradiation;using;interstitial fractionated multicatheter brachytherapy;adjuvant breast irradiation;using;interstitial multicatheter brachytherapy;accelerated partial breast irradiation;using;interstitial high-dose-rate brachytherapy;patients;had undergone;breast-conserving surgery;partial breast irradiation;using;interstitial brachytherapy;partial breast irradiation;using;fractionated high-dose-rate brachytherapy;accelerated breast irradiation;using;brachytherapy;accelerated partial breast irradiation;using;fractionated brachytherapy;breast irradiation;using;multicatheter brachytherapy;adjuvant partial breast irradiation;using;interstitial high-dose-rate brachytherapy;breast irradiation;using;fractionated multicatheter brachytherapy;adjuvant accelerated partial breast irradiation;using;interstitial brachytherapy;adjuvant breast irradiation;using;interstitial multicatheter high-dose-rate brachytherapy;patients;received;partial breast irradiation;adjuvant partial breast irradiation;using;multicatheter brachytherapy;adjuvant breast irradiation;using;fractionated multicatheter high-dose-rate brachytherapy;partial breast irradiation;using;fractionated multicatheter high-dose-rate brachytherapy;breast irradiation;using;interstitial high-dose-rate brachytherapy;adjuvant accelerated partial breast irradiation;using;fractionated multicatheter high-dose-rate brachytherapy;adjuvant breast irradiation;using;brachytherapy;patients;received;adjuvant accelerated breast irradiation;adjuvant breast irradiation;using;interstitial fractionated brachytherapy;accelerated partial breast irradiation;using;multicatheter brachytherapy;accelerated partial breast irradiation;using;interstitial fractionated high-dose-rate brachytherapy;accelerated breast irradiation;using;multicatheter brachytherapy;patients;received;adjuvant breast irradiation;patients;received;accelerated partial breast irradiation;breast irradiation;using;interstitial fractionated brachytherapy;adjuvant breast irradiation;using;interstitial fractionated multicatheter high-dose-rate brachytherapy;partial breast irradiation;using;high-dose-rate brachytherapy;accelerated breast irradiation;using;fractionated multicatheter brachytherapy;adjuvant accelerated breast irradiation;using;multicatheter brachytherapy;adjuvant accelerated breast irradiation;using;fractionated high-dose-rate brachytherapy;partial breast irradiation;using;brachytherapy;adjuvant accelerated breast irradiation;using;interstitial multicatheter high-dose-rate brachytherapy;patients;received;adjuvant accelerated partial breast irradiation;accelerated partial breast irradiation;using;interstitial fractionated multicatheter high-dose-rate brachytherapy;patients;received;adjuvant partial breast irradiation;accelerated partial breast irradiation;using;fractionated multicatheter high-dose-rate brachytherapy;breast irradiation;using;interstitial fractionated high-dose-rate brachytherapy;adjuvant breast irradiation;using;fractionated high-dose-rate brachytherapy;adjuvant accelerated partial breast irradiation;using;fractionated high-dose-rate brachytherapy;breast irradiation;using;fractionated multicatheter high-dose-rate brachytherapy;adjuvant accelerated breast irradiation;using;interstitial fractionated high-dose-rate brachytherapy;accelerated breast irradiation;using;multicatheter high-dose-rate brachytherapy;adjuvant breast irradiation;using;fractionated multicatheter brachytherapy;patients;received;accelerated breast irradiation;adjuvant breast irradiation;using;interstitial high-dose-rate brachytherapy;partial breast irradiation;using;interstitial multicatheter high-dose-rate brachytherapy;adjuvant accelerated partial breast irradiation;using;interstitial fractionated high-dose-rate brachytherapy;patients;had undergone;surgery;adjuvant partial breast irradiation;using;fractionated high-dose-rate brachytherapy;breast irradiation;using;fractionated high-dose-rate brachytherapy;partial breast irradiation;using;interstitial fractionated multicatheter brachytherapy;adjuvant partial breast irradiation;using;fractionated brachytherapy;adjuvant breast irradiation;using;multicatheter brachytherapy;partial breast irradiation;using;interstitial high-dose-rate brachytherapy;adjuvant accelerated partial breast irradiation;using;interstitial multicatheter brachytherapy;adjuvant breast irradiation;using;interstitial fractionated high-dose-rate brachytherapy;accelerated breast irradiation;using;interstitial fractionated high-dose-rate brachytherapy;accelerated breast irradiation;using;fractionated multicatheter high-dose-rate brachytherapy;breast irradiation;using;interstitial multicatheter brachytherapy;adjuvant accelerated partial breast irradiation;using;brachytherapy;adjuvant accelerated partial breast irradiation;using;interstitial multicatheter high-dose-rate brachytherapy;accelerated partial breast irradiation;using;interstitial fractionated multicatheter brachytherapy;accelerated partial breast irradiation;using;fractionated high-dose-rate brachytherapy;adjuvant partial breast irradiation;using;fractionated multicatheter high-dose-rate brachytherapy;partial breast irradiation;using;multicatheter brachytherapy;accelerated partial breast irradiation;using;brachytherapy;adjuvant accelerated breast irradiation;using;brachytherapy;breast irradiation;using;multicatheter high-dose-rate brachytherapy;adjuvant breast irradiation;using;fractionated brachytherapy;accelerated breast irradiation;using;interstitial fractionated multicatheter brachytherapy;partial breast irradiation;using;interstitial fractionated multicatheter high-dose-rate brachytherapy;partial breast irradiation;using;interstitial fractionated brachytherapy;adjuvant partial breast irradiation;using;interstitial fractionated multicatheter high-dose-rate brachytherapy;partial breast irradiation;using;fractionated multicatheter brachytherapy;breast irradiation;using;interstitial fractionated multicatheter high-dose-rate brachytherapy;adjuvant partial breast irradiation;using;high-dose-rate brachytherapy;adjuvant breast irradiation;using;high-dose-rate brachytherapy;adjuvant partial breast irradiation;using;interstitial fractionated high-dose-rate brachytherapy;partial breast irradiation;using;multicatheter high-dose-rate brachytherapy;adjuvant partial breast irradiation;using;interstitial multicatheter brachytherapy;accelerated breast irradiation;using;interstitial fractionated brachytherapy;breast irradiation;using;brachytherapy;accelerated partial breast irradiation;using;high-dose-rate brachytherapy;partial breast irradiation;using;interstitial multicatheter brachytherapy;accelerated breast irradiation;using;interstitial multicatheter high-dose-rate brachytherapy;adjuvant accelerated partial breast irradiation;using;interstitial high-dose-rate brachytherapy;adjuvant partial breast irradiation;using;interstitial fractionated brachytherapy;adjuvant accelerated breast irradiation;using;interstitial fractionated multicatheter high-dose-rate brachytherapy;adjuvant accelerated partial breast irradiation;using;interstitial fractionated multicatheter brachytherapy;accelerated breast irradiation;using;interstitial fractionated multicatheter high-dose-rate brachytherapy;breast irradiation;using;interstitial multicatheter high-dose-rate brachytherapy;adjuvant breast irradiation;using;interstitial fractionated multicatheter brachytherapy;adjuvant partial breast irradiation;using;interstitial fractionated multicatheter brachytherapy;accelerated partial breast irradiation;using;interstitial multicatheter high-dose-rate brachytherapy;adjuvant partial breast irradiation;using;fractionated multicatheter brachytherapy;adjuvant partial breast irradiation;using;interstitial multicatheter high-dose-rate brachytherapy;partial breast irradiation;using;interstitial fractionated high-dose-rate brachytherapy;adjuvant accelerated partial breast irradiation;using;high-dose-rate brachytherapy;adjuvant partial breast irradiation;using;brachytherapy;adjuvant accelerated breast irradiation;using;interstitial fractionated brachytherapy;breast irradiation;using;high-dose-rate brachytherapy;adjuvant accelerated partial breast irradiation;using;multicatheter high-dose-rate brachytherapy;adjuvant breast irradiation;using;interstitial brachytherapy;adjuvant accelerated breast irradiation;using;fractionated multicatheter high-dose-rate brachytherapy;accelerated partial breast irradiation;using;fractionated multicatheter brachytherapy;accelerated partial breast irradiation;using;multicatheter high-dose-rate brachytherapy;adjuvant accelerated breast irradiation;using;high-dose-rate brachytherapy;accelerated breast irradiation;using;interstitial high-dose-rate brachytherapy;adjuvant partial breast irradiation;using;interstitial brachytherapy;adjuvant accelerated breast irradiation;using;interstitial high-dose-rate brachytherapy;adjuvant accelerated partial breast irradiation;using;fractionated brachytherapy;accelerated breast irradiation;using;interstitial multicatheter brachytherapy;adjuvant accelerated breast irradiation;using;fractionated multicatheter brachytherapy;adjuvant breast irradiation;using;multicatheter high-dose-rate brachytherapy;,138
One photograph before and another after accelerated partial breast irradiation was taken for each patient to record changes in breast cosmesis.,photograph;record;changes;photograph;before and another was taken for;patient;One photograph;before was taken for;patient;photograph;was taken for;patient;One photograph;record;changes;One photograph;was taken for;patient;photograph;record;changes in breast cosmesis;One photograph;before and another was taken for;patient;One photograph;record;changes in breast cosmesis;changes;is in;breast cosmesis;photograph;before was taken for;patient;,11
Using the OBCS  before and after photographs were analyzed by measuring distances between anatomic features.,photographs;were;analyzed;photographs;measuring;distances between anatomic features;photographs;measuring;distances between features;photographs;measuring;distances;,4
OBCS scores from four doctors (two males [one radiation oncologist and one post-grad trainee] and two females [one radiation oncologist and one post-grad trainee]) were compared.,,0
Agreement was high between trainees and specialist  and males and females before and after treatment.,Agreement;was;high before treatment;Agreement;was;high treatment;Agreement;was;high between trainees before treatment;Agreement;was high between;trainees;Agreement;was;high between trainees treatment;Agreement;was;high;,6
The intraclass correlation coefficient ranged from 0.867 to 0.950 before treatment and from 0.876 to 0.952 afterward.,correlation coefficient;ranged before;treatment;intraclass correlation coefficient;ranged before;treatment;,2
The coefficient of variation ranged from 12% to 26.5% before treatment  and from 13% to 21.4% afterward.,coefficient;ranged from;13 % to 21.4 %;coefficient;ranged from;12 % to 26.5 %;coefficient;ranged from;12 % to 26.5 % before treatment;coefficient;ranged from;13 % to 21.4 % afterward;coefficient;ranged from;12 %;coefficient;ranged from;13 %;coefficient;ranged from;12 % before treatment;,7
The OBCS is easy  time-efficient  reproducible  cost-effective  and reliable.,OBCS;is;reproducible cost-effective;OBCS;is;easy time-efficient cost-effective;OBCS;is;easy time-efficient reproducible cost-effective;OBCS;is;time-efficient cost-effective;OBCS;is;easy reproducible cost-effective;OBCS;is;time-efficient reproducible cost-effective;OBCS;is;easy cost-effective;OBCS;is;cost-effective;,8
Its potential practical applications merit further investigation in future studies.,Its potential practical applications;merit;further investigation in future studies;Its potential applications;merit;investigation;Its potential applications;merit;investigation in future studies;Its potential practical applications;merit;investigation in future studies;Its potential practical applications;merit;investigation;Its potential applications;merit;further investigation in future studies;Its potential applications;merit;further investigation;Its potential practical applications;merit;further investigation;further investigation;is in;future studies;,9


Insulin resistance associated with hyperinsulinaemia and overexpression of insulin receptors (IRs) have been intricately linked to the pathogenesis and treatment outcomes of the breast carcinoma.,Insulin resistance;have;have linked;Insulin resistance;have;have intricately linked to pathogenesis;Insulin resistance;have;have intricately linked to pathogenesis of breast carcinoma;Insulin resistance;have;have intricately linked;Insulin resistance;have;have linked to pathogenesis;Insulin resistance;have;have linked to pathogenesis of breast carcinoma;,6
Studies have revealed that upregulated expression of IRs in breast cancer pathogenesis regulates several aspects of the malignant phenotype  including cell proliferation and metastasis.,upregulated expression;regulates;several aspects of malignant phenotype;upregulated expression;regulates;several aspects of malignant phenotype including cell proliferation;aspects;upregulated expression of;IRs;upregulated expression;regulates;aspects of phenotype;several aspects;upregulated expression in;breast cancer pathogenesis;upregulated expression;regulates;several aspects;expression;regulates;aspects of phenotype;upregulated expression;regulates;aspects of malignant phenotype;expression;regulates;several aspects of phenotype;expression;regulates;aspects;several aspects;upregulated expression of;IRs;aspects;expression of;IRs;expression;regulates;aspects of phenotype including cell proliferation;expression;regulates;several aspects of malignant phenotype;upregulated expression;regulates;aspects of phenotype including cell proliferation;upregulated expression;regulates;aspects;expression;regulates;aspects of malignant phenotype including cell proliferation;several aspects;expression of;IRs;expression;regulates;several aspects;aspects;upregulated expression in;breast cancer pathogenesis;upregulated expression;regulates;several aspects of phenotype including cell proliferation;upregulated expression;is in;breast cancer pathogenesis;aspects;expression in;breast cancer pathogenesis;several aspects;expression in;breast cancer pathogenesis;expression;regulates;aspects of malignant phenotype;expression;regulates;several aspects of phenotype including cell proliferation;upregulated expression;regulates;several aspects of phenotype;upregulated expression;regulates;aspects of malignant phenotype including cell proliferation;expression;regulates;several aspects of malignant phenotype including cell proliferation;,29
This study was aimed to investigate the pivotal role of an IR antagonist S961 on IR signalling and other biological parameters in MCF-7  MDA-MB-231 and T47D cell lines.,study;investigate;role;study;investigate;pivotal role of IR antagonist S961 on IR signalling in MCF-7 MDA-MB-231;study;investigate;pivotal role on IR signalling;study;investigate;role of IR antagonist S961 on IR signalling;study;investigate;role of IR antagonist S961;study;was;aimed;study;investigate;pivotal role of IR antagonist S961 on IR signalling;study;investigate;role of IR antagonist S961 on IR signalling in MCF-7 MDA-MB-231;study;investigate;pivotal role;study;investigate;pivotal role of IR antagonist S961;study;investigate;role on IR signalling;study;investigate;role on IR signalling in MCF-7 MDA-MB-231;study;investigate;pivotal role on IR signalling in MCF-7 MDA-MB-231;IR signalling;is in;MCF-7 MDA-MB-231;,14
The effect of human insulin and S961 on growth  proliferation rate and clonogenic potential of breast cancer cells was evaluated by MTT [3-(4 5-dimethylthiazol-2-yl)-2 5-diphenyltetrazoliumbromide] assay and clonogenic assay.,effect;was evaluated by;MTT;effect;was;evaluated;,2
The mRNA expression of IR isoforms (IR-A and IR-B) was measured in the breast carcinoma cells using quantitative PCR.,mRNA expression;using;PCR;mRNA expression;was;measured;mRNA expression;using;quantitative PCR;mRNA expression;was measured in;breast carcinoma cells;,4
The study revealed that breast cancer cells predominantly expressed IR-A isoform and showed extensive growth and proliferation owing to IR overexpression.,breast cancer cells;expressed;IR-A isoform;breast cancer cells;showed proliferation owing to;IR overexpression;breast cancer cells;showed;growth;breast cancer cells;showed;proliferation owing;breast cancer cells;showed growth to;IR overexpression;breast cancer cells;predominantly expressed;IR-A isoform;breast cancer cells;showed;extensive growth;,7
It was found that S961 downregulated the IRs (IR-A and IR-B) with nanomolar dose and efficiently blocked expression of IRs even in the presence of insulin.,S961;efficiently blocked expression in;presence;S961;efficiently blocked;expression;S961;blocked;expression of IRs;S961;efficiently blocked expression in;even presence of insulin;S961;downregulated IRs with;nanomolar dose;S961;efficiently blocked expression in;presence of insulin;S961;blocked;expression;S961;blocked expression in;presence;S961;downregulated;IRs;S961;blocked expression in;even presence;It;was;found;S961;efficiently blocked expression in;even presence;S961;blocked expression in;presence of insulin;S961;efficiently blocked;expression of IRs;S961;blocked expression in;even presence of insulin;S961;downregulated IRs with;dose;,16
IR mRNA expression levels were significantly downregulated in the continued presence of S961.,IR mRNA expression levels;were downregulated in;continued presence of S961;IR mRNA expression levels;were downregulated in;presence of S961;IR mRNA expression levels;were downregulated in;presence;IR mRNA expression levels;were significantly downregulated in;presence of S961;IR mRNA expression levels;were;downregulated;IR mRNA expression levels;were;significantly downregulated;IR mRNA expression levels;were downregulated in;continued presence;IR mRNA expression levels;were significantly downregulated in;continued presence of S961;IR mRNA expression levels;were significantly downregulated in;continued presence;IR mRNA expression levels;were significantly downregulated in;presence;,10
S961 also inhibited cellular proliferation and colony formation in breast tumour cells.,proliferation;is in;breast tumour cells;S961;also inhibited;cellular proliferation;S961;inhibited;proliferation;S961;also inhibited;colony formation;S961;inhibited;cellular proliferation;S961;also inhibited;proliferation in breast tumour cells;S961;inhibited;cellular proliferation in breast tumour cells;S961;inhibited;colony formation;S961;inhibited;proliferation in breast tumour cells;S961;also inhibited;proliferation;S961;also inhibited;cellular proliferation in breast tumour cells;,11
IR antagonist  S961 showed distinct antagonism in vitro and appeared to be a powerful therapeutic modality that might provide insight into the pathogenesis of impaired IR signalling.,IR antagonist S961;showed;antagonism;IR antagonist S961;showed;distinct antagonism;,2


The mechanisms underlying cognitive decline after radiotherapy not directed at brain areas remains unclear.,mechanisms;remains;unclear;mechanisms;underlying;decline;mechanisms;underlying;cognitive decline;,3
We previously suggested that adjuvant breast radiotherapy in breast conservation therapy could lower memory function soon after therapy  and that the process might be partially mediated by plasma interleukin (IL)-6 levels.,adjuvant breast radiotherapy;is in;breast conservation therapy;We;suggested;that;We;previously suggested;that;,3
The present study investigated how that relationship changes longitudinally.,,0
We performed the Wechsler Memory Scale-Revised (WMS-R) test and measured plasma IL-6 levels for 47 breast cancer surgical patients within 1 year after the initial therapy (study 1) and more than 2 years after study 1 (study 2).,We;performed;Wechsler Memory test;We;performed;Wechsler Memory Scale-Revised test;,2
We also performed 2 × 2 mixed [the radiotherapy group (n = 25) or the no-radiotherapy group (n = 22) × study 1 or study 2] analysis of covariance on the WMS-R indices and plasma IL-6 levels.,We;performed;2 × 2 mixed;We;also performed;2 × 2 mixed;,2
The association between changes in plasma IL-6 levels and changes in the WMS-R indices between the two studies was evaluated using Pearson's correlation coefficient.,Pearson;has;correlation coefficient;association;was;evaluated;changes;is in;WMS-R indices between two studies;association;using;Pearson 's correlation coefficient;changes;is in;plasma IL-6 levels;,5
The Immediate Verbal Memory Index was significantly higher in study 2.,Immediate Verbal Memory Index;was;higher;Immediate Verbal Memory Index;was higher in;study 2;Immediate Verbal Memory Index;was;significantly higher;Immediate Verbal Memory Index;was significantly higher in;study 2;,4
The Delayed Recall Index was significantly higher in study 2 and significantly lower in the radiotherapy group only in study 1.,The Delayed;was significantly higher in;study 2;The Delayed;was;significantly higher;The;was;significantly higher;The Delayed;was higher in;study 2;The;was;higher;The Delayed;was;higher;The;was significantly higher in;study 2;The;was higher in;study 2;,8
There was a significant correlation between changes in plasma IL-6 levels and changes only in the Delayed Recall Index of the WMS-R.,changes;is in;plasma IL-6 levels;,1
Memory decline in breast cancer patients soon after adjuvant breast radiotherapy was restored approximately 3 years after treatment  and decreased plasma IL-6 levels might be involved in the recovery process.,adjuvant breast radiotherapy;soon was restored after;approximately 3 years;breast radiotherapy;soon was restored after;approximately 3 years;breast radiotherapy;was;soon restored;breast radiotherapy;was;restored;treatment;might;might involved in recovery process;adjuvant breast radiotherapy;was;restored;breast radiotherapy;was restored after;approximately 3 years;treatment;might;might involved;adjuvant breast radiotherapy;was;soon restored;Memory decline;is in;breast cancer patients;adjuvant breast radiotherapy;was restored after;approximately 3 years;,11


To describe the mortality experience of women who die of breast cancer in the 20-year period post-diagnosis using various metrics  including annual mortality rates  Kaplan-Meier survival curves and time-to-death histograms.,,0
We generated three visual representations of SEER-based and hospital-based breast cancer patient cohorts using three different metrics of mortality.,We;generated;three representations of breast cancer patient cohorts;We;generated;three visual representations of breast cancer patient cohorts;We;generated;three representations of SEER-based breast cancer patient cohorts;three representations;using;three metrics;We;generated;three representations;three visual representations;using;three metrics;three visual representations;using;three metrics of mortality;three representations;using;three different metrics;We;generated;three visual representations;three visual representations;using;three different metrics of mortality;three representations;using;three metrics of mortality;three visual representations;using;three different metrics;three representations;using;three different metrics of mortality;We;generated;three visual representations of SEER-based breast cancer patient cohorts;,14
The greatest impact of most prognostic factors was on the probability of latent metastases present after treatment  but for some factors the primary impact was on the time to death for those women with metastases.,,0
The use of time-to-death statistics to display mortality benefits for treated versus untreated women helps facilitate the distinction between treatments which increase the likelihood of cure and treatments that delay cancer growth.,,0


