EgKI-1  a member of the Kunitz type protease inhibitor family  is highly expressed by the oncosphere of the canine tapeworm Echinococcus granulosus  the stage that is infectious to humans and ungulates  giving rise to a hydatid cyst localized to the liver and other organs.,member;is;expressed;member;is highly expressed by;oncosphere of tapeworm Echinococcus;member;is highly expressed by;oncosphere of canine tapeworm Echinococcus;member;is expressed by;oncosphere of canine tapeworm Echinococcus;member;is highly expressed by;oncosphere;member;is expressed by;oncosphere of tapeworm Echinococcus;member;is expressed by;oncosphere;member;is;highly expressed;,8
Larval protoscoleces  which develop within the hydatid cyst  have been shown to possess anti-cancer properties  although the precise molecules involved have not been identified.,,0
We show that recombinant EgKI-1 inhibits the growth and migration of a range of human cancers including breast  melanoma and cervical cancer cell lines in a dose-dependent manner in vitro without affecting normal cell growth.,recombinant EgKI-1;affecting;normal cell growth;EgKI-1;inhibits migration in;manner;EgKI-1;inhibits migration in;dose-dependent manner;recombinant EgKI-1;affecting;cell growth;EgKI-1;inhibits;growth;EgKI-1;inhibits;migration;EgKI-1;inhibits growth in;manner;EgKI-1;inhibits growth in;dose-dependent manner;EgKI-1;affecting;cell growth;EgKI-1;affecting;normal cell growth;,10
Furthermore  EgKI-1 treatment arrested the cancer cell growth by disrupting the cell cycle and induced apoptosis of cancer cells in vitro.,EgKI-1 treatment;disrupting;cell cycle;EgKI-1 treatment;arrested;cancer cell growth;cell cycle;apoptosis of;cancer cells;EgKI-1 treatment;Furthermore arrested;cancer cell growth;cell cycle;induced apoptosis of;cancer cells;,5
An in vivo model of triple negative breast cancer (MDA-MB-231) in BALB/c nude mice showed significant tumor growth reduction in EgKI-1-treated mice compared with controls.,in model;showed;tumor growth reduction in EgKI-1-treated mice;in model;is in;BALB/c nude mice;model;showed;tumor growth reduction in mice;in model;showed;tumor growth reduction;significant tumor growth reduction;is in;EgKI-1-treated mice;in model;showed;significant tumor growth reduction;model;showed;significant tumor growth reduction in mice;in model;showed;significant tumor growth reduction in mice;model;showed;significant tumor growth reduction;model;showed;significant tumor growth reduction in EgKI-1-treated mice;in model;showed;significant tumor growth reduction in EgKI-1-treated mice;in model;showed;tumor growth reduction in mice;model;showed;tumor growth reduction in EgKI-1-treated mice;model;showed;tumor growth reduction;,14
These findings indicate that EgKI-1 shows promise for future development as an anti-cancer therapeutic.,EgKI-1;shows;promise for future development;EgKI-1;promise for;future development;EgKI-1;shows promise as;anti-cancer therapeutic;EgKI-1;shows;promise;EgKI-1;shows promise as;therapeutic;,5


Breast cancer and its treatment can have many physical and psychological effects on affected women.,,0
Women's personal goals may provide insight into their priorities and motivations in the context of breast cancer.,Women 's personal goals;may provide;insight into their priorities;Women 's personal goals;may provide;insight;Women 's personal goals;may provide insight in;context of breast cancer;Women 's goals;may provide insight in;context of breast cancer;Women 's goals;may provide;insight;Women 's personal goals;may provide insight in;context;Women;has;personal goals;Women 's goals;may provide insight in;context;Women 's goals;may provide;insight into their priorities;,9
Incorporating personal goal-setting into support and care interventions may have an effect on psychological well-being.,effect;Incorporating;personal goal-setting;effect;Incorporating goal-setting into;support;effect;Incorporating;goal-setting;,3
This protocol describes our scoping review methods  the aim of which is to examine and map the existing evidence on personal goal-setting among women with a breast cancer diagnosis.,aim;examine;evidence on goal-setting among women;aim;examine;evidence on personal goal-setting among women with breast cancer diagnosis;aim;examine;existing evidence on personal goal-setting;aim;examine;existing evidence on goal-setting among women with breast cancer diagnosis;aim;examine;evidence on personal goal-setting among women;aim;examine;existing evidence on personal goal-setting among women;aim;examine;evidence on goal-setting;aim;examine;existing evidence on goal-setting;aim;examine;existing evidence on goal-setting among women;aim;examine;existing evidence on personal goal-setting among women with breast cancer diagnosis;aim;examine;existing evidence;women;is with;breast cancer diagnosis;aim;examine;evidence on personal goal-setting;aim;examine;evidence on goal-setting among women with breast cancer diagnosis;aim;examine;evidence;,15
Our scoping review will search for published  full-length articles  where personal goal-setting is a major component of the study  and the study population is females with breast cancer.,goal-setting;is;major component;personal goal-setting;is;where component;goal-setting;is;where component;personal goal-setting;is;major component;females;is with;breast cancer;personal goal-setting;is;where major component of study;goal-setting;is;major;study population;is females with;breast cancer;personal goal-setting;is major component of;study;personal goal-setting;is;component;goal-setting;is;component;goal-setting;is component of;study;goal-setting;is;where component of study;personal goal-setting;is;where major component;study population;is;females;goal-setting;is;where major component of study;goal-setting;is major component of;study;personal goal-setting;is component of;study;goal-setting;is;where major component;personal goal-setting;is;where component of study;,20
MEDLINE  PsycInfo  CINAHL  EMBASE  the Cochrane Library  and AMED databases will be searched.,Cochrane Library;be;searched;,1
Two independent reviewers will conduct all screening and extract data.,,0
Descriptive information about the studies  participants  any interventions  measurement tools  outcomes  and results will be reported.,interventions measurement tools outcomes;information about;studies;interventions measurement tools outcomes;Descriptive information about;studies;,2
The results from this review will chart the literature  contributing to optimizing the incorporation of personal goal-setting approaches into effective interventions for the care and support of women with breast cancer.,literature;approaches into;interventions;literature;approaches into;effective interventions for care;literature;approaches into;interventions for care;women;is with;breast cancer;literature;approaches into;effective interventions;,5


Breast cancer is the most diagnosed diseases and the second-leading cause of death in females  among which the estrogen receptor positive (ER+) patients are more common of all cases.,Breast cancer;is;most diagnosed diseases;Breast cancer;second-leading cause of;death;Breast cancer;is;diagnosed diseases;estrogen receptor patients;are common of;cases;estrogen receptor patients;are more common of;cases;estrogen receptor positive patients;are common of;cases;second-leading cause;is in;females;Breast cancer;is;diseases;Breast cancer;cause of;death;estrogen receptor positive patients;are more common of;cases;,10
In present study  we selected MCF-7 as an in vitro model and investigated the combinatorial anti-proliferative effects of tamoxifen and naringenin on ER+ breast cancer  and then explored the potential mechanisms involved in mitochondrial dysfunction and oxidative stress mediated by several estrogen receptor subtypes.,we;investigated;anti-proliferative effects;investigated;effects on;ER cancer;we;investigated;anti-proliferative effects of tamoxifen on ER cancer;investigated;anti-proliferative effects on;ER cancer;we;selected MCF-7 as;in model;we;investigated;combinatorial anti-proliferative effects of tamoxifen;we;explored;potential mechanisms involved in mitochondrial dysfunction mediated by several estrogen receptor subtypes;we;investigated;effects of tamoxifen;we;explored;potential mechanisms involved in dysfunction;we;explored;potential mechanisms involved in dysfunction mediated by estrogen receptor subtypes;we;explored;potential mechanisms involved in mitochondrial dysfunction mediated;we;explored;potential mechanisms;we;explored;potential mechanisms involved in mitochondrial dysfunction;we;investigated;effects;we;explored;potential mechanisms involved in dysfunction mediated;we;investigated;combinatorial effects on ER cancer;we;selected;MCF-7;we;investigated;effects of tamoxifen on ER cancer;we;explored;potential mechanisms involved in dysfunction mediated by several estrogen receptor subtypes;we;investigated;combinatorial effects of tamoxifen on ER cancer;investigated;combinatorial effects of;tamoxifen;investigated;anti-proliferative effects of;tamoxifen;we;investigated;combinatorial anti-proliferative effects of tamoxifen on ER cancer;we;explored;potential mechanisms involved;we;investigated;anti-proliferative effects on ER cancer;we;selected MCF-7 as;model;we;selected MCF-7 In;present study;investigated;combinatorial anti-proliferative effects of;tamoxifen;we;investigated;combinatorial effects of tamoxifen;we;investigated;anti-proliferative effects of tamoxifen;we;investigated;combinatorial anti-proliferative effects on ER cancer;we;investigated;combinatorial anti-proliferative effects;investigated;combinatorial effects on;ER cancer;we;selected MCF-7 In;study;we;investigated;effects on ER cancer;investigated;combinatorial anti-proliferative effects on;ER cancer;we;explored;potential mechanisms involved in mitochondrial dysfunction mediated by estrogen receptor subtypes;we;investigated;combinatorial effects;investigated;effects of;tamoxifen;,39
Six assessment endpoints including cell viability  cell migration  cell cycle  cell apoptosis  mRNA  and protein expression were estimated.,,0
Tamoxifen and naringenin were shown to inhibit the cell growth of MCF-7 cells at higher concentrations  and co-exposure with them significantly inhibited cell proliferation in an additive manner.,cell growth;inhibited cell proliferation in;manner;cell growth;significantly inhibited cell proliferation in;manner;naringenin;inhibit;cell growth of MCF-7 cells at concentrations;cell growth;significantly inhibited cell proliferation in;additive manner;naringenin;inhibit;cell growth;naringenin;inhibit;cell growth at higher concentrations;cell growth;significantly inhibited;cell proliferation;cell growth;inhibited cell proliferation in;additive manner;naringenin;inhibit;cell growth of MCF-7 cells at higher concentrations;naringenin;inhibit;cell growth of MCF-7 cells;cell growth;inhibited;cell proliferation;naringenin;inhibit;cell growth at concentrations;naringenin;inhibit cell growth with;them;Tamoxifen;were;shown;,14
Results from a wound healing assay indicated that the combined treatment of tamoxifen and naringenin markedly suppressed cell migration compared with the single exposure by downregulating the expression of MMP-9 and MMP-2.,combined treatment;suppressed;cell migration;treatment;markedly suppressed;cell migration;cell migration;treatment of;tamoxifen;cell migration;combined treatment of;tamoxifen;treatment;suppressed;cell migration;combined treatment;markedly suppressed;cell migration;,6
Flow cytometry analysis revealed that the combined treatment of tamoxifen and naringenin blocked cell cycle in G2/M phase through suppressing the transcription of cell cycle regulation proteins.,combined treatment;blocked;cell cycle;treatment;blocked cell cycle in;G2/M phase;combined treatment;suppressing;transcription;treatment;suppressing;transcription of cell cycle regulation proteins;treatment;blocked;cell cycle;cell cycle;treatment of;tamoxifen;treatment;suppressing;transcription;combined treatment;suppressing;transcription of cell cycle regulation proteins;combined treatment;blocked cell cycle in;G2/M phase;cell cycle;combined treatment of;tamoxifen;,10
Simultaneously  co-treatment with them also induced cell apoptosis by regulating the expression of mitochondrial apoptotic proteins as well as by simulating the production of reactive oxygen species (ROS).,co-treatment;regulating;expression;co-treatment;is with;them;co-treatment;regulating;expression of mitochondrial proteins;co-treatment;induced;cell apoptosis;co-treatment;also induced;cell apoptosis;co-treatment;regulating;expression of mitochondrial apoptotic proteins;co-treatment;regulating;expression of proteins;co-treatment;regulating;expression of apoptotic proteins;,8
Real-time quantitative polymerase chain reaction (RT-qPCR) and western blotting (WB) analysis results further demonstrated that the two nuclear estrogen receptors-ERα66 and ERβ  as well as the two membrane estrogen receptors-ERα36 and GPR30 were downregulated when cells were exposed to single tamoxifen  whereas naringenin treatment group not only downregulated the expression of ERα66 and GPR30 but also upregulated ERβ and ERα36.,cells;were;when exposed to tamoxifen;cells;were;exposed;cells;were exposed to;tamoxifen;naringenin treatment group;expression of;ERα66;cells;were;when exposed to single tamoxifen;cells;were exposed to;single tamoxifen;cells;were;when exposed;,7
Interestingly  co-treatment group resulted in significant downregulation of ERα66  ERα36 and GPR30 but upregulation of ERβ.,,0
Taken together  co-treatment of tamoxifen and naringenin could inhibit cell proliferation more effectively in ER+ breast cancer cells  which was associated with a modulation of the expression levels of several estrogen receptors.,cell proliferation;Taken;co-treatment of tamoxifen;cell proliferation;Taken;co-treatment;cell proliferation;Taken together;co-treatment of tamoxifen;cell proliferation;Taken together;co-treatment;,4


The purpose of this study was to develop a realistic patient-based 4D digital breast phantom including time-varying contrast enhancement for simulation of dedicated breast CT perfusion imaging.,purpose;develop;realistic 4D breast phantom including time-varying contrast enhancement;purpose;develop;4D digital breast phantom including contrast enhancement for simulation of dedicated breast CT perfusion imaging;purpose;develop;4D digital breast phantom including time-varying contrast enhancement for simulation;purpose;develop;patient-based 4D breast phantom including contrast enhancement for simulation;purpose;develop;4D breast phantom including time-varying contrast enhancement for simulation;purpose;develop;realistic patient-based 4D digital breast phantom including contrast enhancement for simulation;purpose;develop;patient-based 4D breast phantom including time-varying contrast enhancement for simulation of breast CT perfusion imaging;purpose;develop;realistic patient-based 4D breast phantom including time-varying contrast enhancement for simulation of breast CT perfusion imaging;purpose;develop;patient-based 4D breast phantom;purpose;develop;realistic 4D digital breast phantom including time-varying contrast enhancement for simulation of dedicated breast CT perfusion imaging;purpose;develop;realistic 4D breast phantom;purpose;develop;patient-based 4D digital breast phantom including contrast enhancement;purpose;develop;realistic patient-based 4D breast phantom including time-varying contrast enhancement;purpose;develop;patient-based 4D breast phantom including time-varying contrast enhancement for simulation;purpose;develop;4D digital breast phantom including time-varying contrast enhancement for simulation of dedicated breast CT perfusion imaging;purpose;develop;realistic patient-based 4D digital breast phantom including contrast enhancement for simulation of breast CT perfusion imaging;purpose;develop;realistic 4D digital breast phantom including time-varying contrast enhancement for simulation;purpose;develop;realistic patient-based 4D breast phantom including contrast enhancement for simulation;purpose;develop;realistic patient-based 4D breast phantom including contrast enhancement for simulation of breast CT perfusion imaging;purpose;develop;4D digital breast phantom including contrast enhancement for simulation;purpose;develop;realistic 4D breast phantom including contrast enhancement for simulation;purpose;develop;patient-based 4D breast phantom including contrast enhancement for simulation of breast CT perfusion imaging;purpose;develop;4D digital breast phantom including time-varying contrast enhancement for simulation of breast CT perfusion imaging;purpose;develop;realistic patient-based 4D breast phantom including time-varying contrast enhancement for simulation of dedicated breast CT perfusion imaging;purpose;develop;realistic patient-based 4D digital breast phantom including time-varying contrast enhancement for simulation of dedicated breast CT perfusion imaging;purpose;develop;realistic patient-based 4D digital breast phantom;purpose;develop;patient-based 4D digital breast phantom including time-varying contrast enhancement for simulation;purpose;develop;patient-based 4D digital breast phantom including contrast enhancement for simulation of breast CT perfusion imaging;purpose;develop;4D breast phantom;purpose;develop;realistic 4D breast phantom including contrast enhancement for simulation of dedicated breast CT perfusion imaging;purpose;develop;4D breast phantom including time-varying contrast enhancement;purpose;develop;4D breast phantom including contrast enhancement for simulation of dedicated breast CT perfusion imaging;purpose;develop;realistic 4D digital breast phantom including time-varying contrast enhancement;purpose;develop;realistic 4D digital breast phantom including time-varying contrast enhancement for simulation of breast CT perfusion imaging;purpose;develop;patient-based 4D digital breast phantom including contrast enhancement for simulation of dedicated breast CT perfusion imaging;purpose;develop;patient-based 4D digital breast phantom including time-varying contrast enhancement for simulation of breast CT perfusion imaging;purpose;develop;realistic patient-based 4D breast phantom;purpose;develop;realistic 4D digital breast phantom including contrast enhancement for simulation of dedicated breast CT perfusion imaging;purpose;develop;4D digital breast phantom including time-varying contrast enhancement;purpose;develop;realistic 4D breast phantom including time-varying contrast enhancement for simulation;purpose;develop;patient-based 4D breast phantom including time-varying contrast enhancement for simulation of dedicated breast CT perfusion imaging;purpose;develop;patient-based 4D breast phantom including time-varying contrast enhancement;purpose;develop;realistic patient-based 4D digital breast phantom including time-varying contrast enhancement for simulation;purpose;develop;4D breast phantom including contrast enhancement for simulation of breast CT perfusion imaging;purpose;develop;realistic 4D breast phantom including time-varying contrast enhancement for simulation of breast CT perfusion imaging;purpose;develop;4D breast phantom including contrast enhancement;purpose;develop;realistic patient-based 4D digital breast phantom including contrast enhancement;purpose;develop;4D breast phantom including time-varying contrast enhancement for simulation of breast CT perfusion imaging;purpose;develop;4D digital breast phantom;purpose;develop;realistic 4D digital breast phantom including contrast enhancement for simulation;purpose;develop;realistic 4D breast phantom including contrast enhancement;purpose;develop;patient-based 4D digital breast phantom;purpose;develop;realistic 4D breast phantom including contrast enhancement for simulation of breast CT perfusion imaging;purpose;develop;realistic 4D digital breast phantom including contrast enhancement;purpose;develop;4D breast phantom including time-varying contrast enhancement for simulation of dedicated breast CT perfusion imaging;purpose;develop;patient-based 4D digital breast phantom including time-varying contrast enhancement;purpose;develop;realistic patient-based 4D digital breast phantom including time-varying contrast enhancement for simulation of breast CT perfusion imaging;purpose;develop;4D digital breast phantom including contrast enhancement;purpose;develop;realistic 4D digital breast phantom;purpose;develop;patient-based 4D breast phantom including contrast enhancement for simulation of dedicated breast CT perfusion imaging;purpose;develop;realistic patient-based 4D breast phantom including contrast enhancement;purpose;develop;realistic 4D breast phantom including time-varying contrast enhancement for simulation of dedicated breast CT perfusion imaging;purpose;develop;realistic patient-based 4D breast phantom including time-varying contrast enhancement for simulation;purpose;develop;patient-based 4D digital breast phantom including time-varying contrast enhancement for simulation of dedicated breast CT perfusion imaging;purpose;develop;4D breast phantom including contrast enhancement for simulation;purpose;develop;realistic patient-based 4D digital breast phantom including time-varying contrast enhancement;purpose;develop;patient-based 4D digital breast phantom including contrast enhancement for simulation;purpose;develop;realistic 4D digital breast phantom including contrast enhancement for simulation of breast CT perfusion imaging;purpose;develop;realistic patient-based 4D breast phantom including contrast enhancement for simulation of dedicated breast CT perfusion imaging;purpose;develop;realistic patient-based 4D digital breast phantom including contrast enhancement for simulation of dedicated breast CT perfusion imaging;purpose;develop;patient-based 4D breast phantom including contrast enhancement;purpose;develop;4D digital breast phantom including contrast enhancement for simulation of breast CT perfusion imaging;,72
A 3D static phantom is first created by segmenting a breast CT image from a healthy patient into skin  fibroglandular tissue  adipose tissue  and vasculature.,3D static phantom;segmenting breast CT image from;patient;3D phantom;segmenting breast CT image from;patient into skin fibroglandular tissue adipose tissue;3D phantom;is;created;3D static phantom;segmenting breast CT image from;healthy patient into skin fibroglandular tissue adipose tissue;3D phantom;is;first created;3D phantom;segmenting breast CT image from;healthy patient into skin fibroglandular tissue adipose tissue;3D phantom;segmenting;breast CT image;3D static phantom;is;created;3D static phantom;segmenting breast CT image from;healthy patient;3D static phantom;segmenting breast CT image from;patient into skin tissue adipose tissue;3D static phantom;segmenting breast CT image from;patient into skin fibroglandular tissue adipose tissue;3D static phantom;segmenting breast CT image from;healthy patient into skin tissue adipose tissue;3D phantom;segmenting breast CT image from;healthy patient;3D phantom;segmenting breast CT image from;patient into skin tissue adipose tissue;3D static phantom;segmenting;breast CT image;3D phantom;segmenting breast CT image from;healthy patient into skin tissue adipose tissue;3D static phantom;is;first created;3D phantom;segmenting breast CT image from;patient;,18
For the creation of abnormal cases  a breast lesion model was developed and can be added to the phantom.,breast lesion model;was;developed;breast lesion model;be added to;phantom;breast lesion model;be;added;,3
After defining the necessary perfusion parameters for each tissue (e.g.  arterial input function for vasculature  blood volume and blood flow for the other normal tissues) based on contrast-enhanced dynamic breast MRI data  the corresponding time-enhancement curves are computed for each voxel in the phantom  according to tissue type.,curves;are computed for;voxel;corresponding curves;are;computed for voxel in phantom;time-enhancement curves;are;computed for voxel in phantom;corresponding time-enhancement curves;are;computed for voxel in phantom;curves;are;computed for voxel in phantom;time-enhancement curves;are computed for;voxel;corresponding time-enhancement curves;are computed for;voxel;corresponding curves;are computed for;voxel;,8
These curves are calculated by convolution between the arterial input function and a shifted exponential function.,curves;are calculated by;convolution between input function;curves;are calculated by;convolution;curves;are;calculated;curves;are calculated by;convolution between arterial input function;,4
