This exponential depends on the perfusion parameters associated with each tissue voxel  and  to incorporate normal biological variability  a uniform random distribution is used to vary the perfusion parameters on a voxel-basis.,uniform random distribution;is used;vary;uniform random distribution;vary on;voxel-basis;random distribution;is used;vary;random distribution;is used;vary on voxel-basis;random distribution;is;used;uniform distribution;vary;perfusion parameters;random distribution;vary;perfusion parameters;exponential;depends on;perfusion parameters;distribution;vary on;voxel-basis;uniform random distribution;vary perfusion parameters on;voxel-basis;exponential;depends on;perfusion parameters associated with tissue voxel;uniform distribution;is;used;uniform random distribution;is used;vary on voxel-basis;uniform random distribution;vary;perfusion parameters;distribution;is used;vary;distribution;vary;perfusion parameters;random distribution;vary perfusion parameters on;voxel-basis;uniform distribution;is used;vary;distribution;is;used;random distribution;vary on;voxel-basis;uniform distribution;vary perfusion parameters on;voxel-basis;uniform random distribution;is;used;uniform distribution;vary on;voxel-basis;distribution;is used;vary on voxel-basis;uniform distribution;is used;vary on voxel-basis;distribution;vary perfusion parameters on;voxel-basis;,26
Finally  a 4D array is produced by sampling the continuous time-enhancement curves at the desired sampling rate.,4D array;Finally is produced by;sampling;4D array;is;produced;4D array;is produced by;sampling;4D array;is;Finally produced;,4
Beside modeling different enhancement dynamics according to the given input perfusion parameters  the phantom also includes the possibility to realistically simulate different spatial enhancement patterns for the breast parenchyma  taking into account the arterial sources supplying the breast.,arterial sources;supplying;breast;sources;supplying;breast;,2
Finally  different patterns of contrast medium uptake can also be simulated for the tumor models (homogeneous and rim enhancement).,patterns;can;can simulated;patterns;can;can also simulated for tumor models;different patterns;can;can simulated for tumor models;patterns;can;can simulated for tumor models;different patterns;can;can also simulated;different patterns;can;can simulated;different patterns;can;can also simulated for tumor models;patterns;can;can also simulated;,8
As an example  a typical 4D phantom has dimensions of 426 × 421 × 260 × 559 (x  y  z  t)  with a voxel size of 273 μm and a sampling time of 1 s.,4D phantom;has;dimensions of;4D phantom;has dimensions As;example;typical 4D phantom;has;dimensions;4D;has;dimensions of;typical 4D;has;dimensions of;typical 4D phantom;has dimensions As;example;typical 4D phantom;has;dimensions of;4D;has;dimensions;typical 4D;has dimensions As;example;4D phantom;has;dimensions;×;is with;voxel size of 273 μm;typical 4D;has;dimensions;4D;has dimensions As;example;,13
The characteristics of the tumor model can be modified at will to evaluate perfusion in different types of breast lesions.,characteristics;evaluate;perfusion in types of breast lesions;characteristics;evaluate;perfusion;perfusion;is in;different types of breast lesions;characteristics;evaluate;perfusion in types;characteristics;evaluate;perfusion in different types;characteristics;can;can modified;characteristics;evaluate;perfusion in different types of breast lesions;,7
Results show the expected enhancement of tissues  consistent with the given input parameters.,Results;show;enhancement of tissues consistent;Results;show;expected enhancement;Results;show;expected enhancement of tissues consistent with input parameters;Results;show;expected enhancement of tissues consistent with given input parameters;Results;show;enhancement of tissues consistent with input parameters;Results;show;expected enhancement of tissues consistent;Results;show;enhancement;Results;show;enhancement of tissues consistent with given input parameters;Results;show;enhancement of tissues;Results;show;expected enhancement of tissues;,10
Moreover  the tumor models evaluated in this work show different enhancement dynamics according to the tumor type (defined by different input perfusion parameters)  and also present a higher enhancement compared to the other healthy tissues  as expected.,tumor models;Moreover show;different enhancement dynamics;tumor models;Moreover show;enhancement dynamics;tumor models;show;enhancement dynamics;tumor models;evaluated in;work;tumor models;show;different enhancement dynamics;,5
The proposed digital phantom can model the breast tissue perfusion during 4D breast CT image acquisition  displaying the different enhancement dynamics that could be found in a real patient breast.,digital phantom;can model breast tissue perfusion during;4D breast CT image acquisition;proposed digital phantom;can model;breast tissue perfusion;phantom;can model breast tissue perfusion during;4D breast CT image acquisition;digital phantom;can model;breast tissue perfusion;phantom;can model;breast tissue perfusion;proposed phantom;can model;breast tissue perfusion;proposed phantom;can model breast tissue perfusion during;4D breast CT image acquisition;proposed digital phantom;can model breast tissue perfusion during;4D breast CT image acquisition;,8
This phantom can be used during the development of dynamic contrast-enhanced dedicated breast CT imaging  for optimization of image acquisition  image reconstruction  and image analysis.,phantom;can;can used during development of contrast-enhanced dedicated breast CT imaging;phantom;can;can used during development of contrast-enhanced dedicated breast CT imaging for optimization;phantom;can;can used during development of dedicated breast CT imaging;phantom;can;can used during development of contrast-enhanced dedicated breast CT imaging for optimization of image acquisition image reconstruction;phantom;can;can used during development of dynamic contrast-enhanced dedicated breast CT imaging;phantom;can;can used during development of contrast-enhanced breast CT imaging for optimization of image acquisition image reconstruction;phantom;can;can used during development of dedicated breast CT imaging for optimization;phantom;can;can used during development of dynamic dedicated breast CT imaging;phantom;can;can used during development of dynamic breast CT imaging for optimization;phantom;can;can used during development of contrast-enhanced breast CT imaging;phantom;can;can used during development of dynamic breast CT imaging;phantom;can;can used;phantom;can;can used during development of breast CT imaging for optimization;phantom;can;can used during development of contrast-enhanced breast CT imaging for optimization;phantom;can;can used during development of breast CT imaging;phantom;can;can used during development of dynamic dedicated breast CT imaging for optimization;phantom;can;can used during development for optimization;phantom;can;can used during development of dedicated breast CT imaging for optimization of image acquisition image reconstruction;phantom;can;can used during development;phantom;can;can used during development of dynamic contrast-enhanced dedicated breast CT imaging for optimization;phantom;can;can used during development of dynamic contrast-enhanced dedicated breast CT imaging for optimization of image acquisition image reconstruction;phantom;can;can used during development of breast CT imaging for optimization of image acquisition image reconstruction;phantom;can;can used during development of dynamic breast CT imaging for optimization of image acquisition image reconstruction;phantom;can;can used during development of dynamic contrast-enhanced breast CT imaging for optimization;phantom;can;can used during development for optimization of image acquisition image reconstruction;phantom;can;can used during development of dynamic contrast-enhanced breast CT imaging;phantom;can;can used during development of dynamic contrast-enhanced breast CT imaging for optimization of image acquisition image reconstruction;phantom;can;can used during development of dynamic dedicated breast CT imaging for optimization of image acquisition image reconstruction;,28
This modality could provide functional information of the breast  resulting in detection  diagnosis  and treatment improvements of breast cancer with breast CT.,detection diagnosis;is with;breast CT.;modality;could provide;information;modality;could provide;functional information of breast resulting in detection diagnosis;modality;could provide;information of breast;modality;could provide;functional information of breast resulting in detection diagnosis with breast CT.;modality;could provide;information of breast resulting in detection diagnosis of breast cancer with breast CT.;modality;could provide;information of breast resulting in detection diagnosis;modality;could provide;functional information of breast resulting in detection diagnosis of breast cancer with breast CT.;modality;could provide;functional information of breast resulting in detection diagnosis of breast cancer;modality;could provide;information of breast resulting in detection diagnosis of breast cancer;modality;could provide;functional information of breast;modality;could provide;information of breast resulting;modality;could provide;functional information;modality;could provide;functional information of breast resulting;modality;could provide;information of breast resulting in detection diagnosis with breast CT.;,15


Orthosiphon pallidus (O. pallidus)  which belongs to the Lamiaceae family  is a popular garden plant that is widely used for the treatment of various diseases  such as urinary lithiasis  fever  hepatitis  cancer and jaundice.,pallidus;is;popular;,1
The objective of the present work was to investigate the antioxidant free-radical scavenging and the anticancer activities of O. pallidus against human breast-cancer cell lines.,anticancer activities;free-radical scavenging against;human cell lines;objective;investigate;activities;objective;investigate;anticancer activities;activities;antioxidant free-radical scavenging against;human breast-cancer cell lines;objective;investigate;antioxidant scavenging;objective;investigate;activities of O. pallidus;objective;investigate;free-radical scavenging against human cell lines;activities;antioxidant scavenging against;human cell lines;objective;investigate;antioxidant scavenging against human cell lines;activities;scavenging against;breast-cancer cell lines;anticancer activities;free-radical scavenging against;cell lines;activities;antioxidant free-radical scavenging against;breast-cancer cell lines;anticancer activities;antioxidant scavenging against;human breast-cancer cell lines;anticancer activities;antioxidant free-radical scavenging against;human breast-cancer cell lines;anticancer activities;antioxidant free-radical scavenging against;cell lines;activities;free-radical scavenging against;breast-cancer cell lines;activities;antioxidant free-radical scavenging against;human cell lines;anticancer activities;antioxidant free-radical scavenging against;human cell lines;activities;free-radical scavenging against;cell lines;activities;antioxidant scavenging against;breast-cancer cell lines;activities;scavenging against;human cell lines;activities;free-radical scavenging against;human cell lines;activities;antioxidant scavenging against;human breast-cancer cell lines;anticancer activities;scavenging against;human cell lines;objective;investigate;free-radical scavenging against human breast-cancer cell lines;anticancer activities;scavenging against;human breast-cancer cell lines;anticancer activities;antioxidant scavenging against;cell lines;anticancer activities;free-radical scavenging against;breast-cancer cell lines;objective;investigate;antioxidant free-radical scavenging;activities;scavenging against;cell lines;activities;free-radical scavenging against;human breast-cancer cell lines;objective;investigate;scavenging;objective;investigate;antioxidant free-radical scavenging against human cell lines;objective;investigate;antioxidant free-radical scavenging against cell lines;objective;investigate;antioxidant scavenging against breast-cancer cell lines;objective;investigate;scavenging against human breast-cancer cell lines;objective;investigate;scavenging against cell lines;objective;investigate;anticancer activities of O. pallidus;objective;investigate;free-radical scavenging;anticancer activities;scavenging against;cell lines;anticancer activities;antioxidant scavenging against;breast-cancer cell lines;objective;investigate;antioxidant scavenging against human breast-cancer cell lines;anticancer activities;antioxidant free-radical scavenging against;breast-cancer cell lines;objective;investigate;antioxidant scavenging against cell lines;activities;antioxidant free-radical scavenging against;cell lines;objective;investigate;antioxidant free-radical scavenging against breast-cancer cell lines;activities;antioxidant scavenging against;cell lines;activities;scavenging against;human breast-cancer cell lines;objective;investigate;free-radical scavenging against cell lines;objective;investigate;scavenging against human cell lines;objective;investigate;scavenging against breast-cancer cell lines;anticancer activities;free-radical scavenging against;human breast-cancer cell lines;objective;investigate;free-radical scavenging against breast-cancer cell lines;anticancer activities;antioxidant scavenging against;human cell lines;objective;investigate;antioxidant free-radical scavenging against human breast-cancer cell lines;anticancer activities;scavenging against;breast-cancer cell lines;,56
The antioxidant activity of Orthosiphon pallidus aqueous extract (OPAE) was investigated using different models  such as the 1 1-diphenyl-2-picrylhydrazyl (DPPH) and the 2  2'-azinobis-(3-ethylbenzothiazoline-6-sulfonic acid) (ABTS) models  as were the Fe+ chelation  the hydroxyl radical and superoxide radical scavenging  and total reducing power activities.,antioxidant activity;using;models;using;models such as;1 1-diphenyl-2-picrylhydrazyl;using;different models such as;DPPH;activity;was;investigated;activity;using;models;activity;using;different models;using;different models such as;1 1-diphenyl-2-picrylhydrazyl;using;models such as;DPPH;total;reducing;power activities;antioxidant activity;using;different models;,10
The anticancer activities of the extract were determined by using the 3-(4  5- dimethylthiazolyl-2)-2  5-diphenyltetrazolium bromide (MTT) and the sulforhodamine (SRB) assays on the MCF-7 and the MDA-MB-231 cancer cell lines.,anticancer activities;were;determined;anticancer activities;using;3;activities;were;determined;activities;using;3;,4
The aqueous Orthosiphon pallidus extract showed potent activity in in-vitro models.,Orthosiphon pallidus extract;showed;activity;potent activity;is in;in-vitro models;aqueous Orthosiphon pallidus extract;showed;activity in models;aqueous Orthosiphon pallidus extract;showed;potent activity;Orthosiphon pallidus extract;showed;activity in in-vitro models;aqueous Orthosiphon pallidus extract;showed;activity in in-vitro models;Orthosiphon pallidus extract;showed;potent activity;aqueous Orthosiphon pallidus extract;showed;activity;aqueous Orthosiphon pallidus extract;showed;potent activity in models;Orthosiphon pallidus extract;showed;activity in models;Orthosiphon pallidus extract;showed;potent activity in in-vitro models;aqueous Orthosiphon pallidus extract;showed;potent activity in in-vitro models;Orthosiphon pallidus extract;showed;potent activity in models;,13
It significantly inhibited the scavenging of hydroxyl and superoxide radicals  but induced a remarkable Fe+ chelation activity.,,0
For both cell lines  the percent cytotoxicity was found to increase steadily with increasing OPAE concentration up to 240 �g/mL.,percent cytotoxicity;increase steadily with;increasing OPAE concentration;percent cytotoxicity;increase steadily with;increasing OPAE concentration up to 240 g/mL;percent cytotoxicity;increase with;increasing OPAE concentration;percent cytotoxicity;increase steadily with;OPAE concentration;percent cytotoxicity;increase with;OPAE concentration up to 240 g/mL;percent cytotoxicity;increase with;increasing OPAE concentration up to 240 g/mL;percent cytotoxicity;was found For;cell lines;percent cytotoxicity;increase steadily with;OPAE concentration up to 240 g/mL;percent cytotoxicity;increase with;OPAE concentration;,9
These results suggest that Orthosiphon pallidus has excellent antioxidant  antimicrobial  and anticancer activities against human breast-cancer cell lines.,Orthosiphon pallidus;has;anticancer;Orthosiphon pallidus;has;antimicrobial;Orthosiphon pallidus;has;antioxidant antimicrobial;Orthosiphon pallidus;has;excellent antioxidant antimicrobial;Orthosiphon pallidus;has;excellent antimicrobial;,5


This study aimed to assess the efficacy of anthracycline-based (AB) and non-anthracycline-based (nAB) adjuvant therapies in the human epidermal growth factor receptor 2 (HER2)-positive non-metastatic BC (nMBC) patients.,anthracycline-based adjuvant therapies;is in;human epidermal growth factor receptor 2;,1
This retrospective study included women with HER2-positive BCs (stage I-III) treated with trastuzumab from 2008 to 2017.,women;is with;HER2-positive BCs treated from 2008 to 2017;study;included;women;study;included;women with BCs treated with trastuzumab from 2008 to 2017;retrospective study;included;women with BCs treated;retrospective study;included;women with HER2-positive BCs treated with trastuzumab;study;included;women with HER2-positive BCs treated;retrospective study;included;women with BCs treated from 2008 to 2017;retrospective study;included;women with BCs;study;included;women with HER2-positive BCs treated with trastuzumab;study;included;women with BCs;retrospective study;included;women with BCs treated with trastuzumab;retrospective study;included;women with HER2-positive BCs treated with trastuzumab from 2008 to 2017;study;included;women with BCs treated with trastuzumab;study;included;women with HER2-positive BCs;retrospective study;included;women with HER2-positive BCs treated;retrospective study;included;women with BCs treated with trastuzumab from 2008 to 2017;retrospective study;included;women with HER2-positive BCs treated from 2008 to 2017;study;included;women with HER2-positive BCs treated from 2008 to 2017;study;included;women with HER2-positive BCs treated with trastuzumab from 2008 to 2017;retrospective study;included;women;study;included;women with BCs treated from 2008 to 2017;study;included;women with BCs treated;retrospective study;included;women with HER2-positive BCs;,23
The patients were divided into two groups  including 196 patients in group AB and 67 in group nAB.,patients;were divided into;two groups including 196 patients;patients;were divided into;two groups;196 patients;is in;group AB;patients;were;divided;patients;were divided into;two groups including 196 patients in group AB;,5
Cox's proportional hazard regression analysis showed no unfavourable predictors for five-year overall survival (OS) and disease-free survival (DFS) except for stage and hormone therapy.,Cox;has;proportional hazard regression analysis;,1
The OS rate was 67.9% in group AB and 80.6% in group nAB (p = 0.630).,p;=;0.630;67.9 %;is in;group AB;80.6 %;is in;group nAB;,3
The DFS rate was 61.6% in group AB compared with 67.1% in group nAB (p = 0.447).,DFS rate;was;61.6 % in group AB;61.6 %;is in;group AB;DFS rate;was;61.6 %;p;=;0.447;67.1 %;is in;group nAB;,5
The results showed no difference between the efficacies of AB and nAB regimens in HER2-positive nMBCs in adjuvant setting.,,0
Therefore  selecting the nAB regimen can reduce the serious damage caused by the AB regimen.,damage;Therefore selecting;nAB regimen;serious damage;Therefore selecting;nAB regimen;damage;selecting;nAB regimen;serious damage;selecting;nAB regimen;,4


To assess the feasibility of a team-based prognosis and treatment goal discussion for women living with advanced breast cancer.,,0
Female patients diagnosed with advanced breast cancer (n = 25) participated in a mixed methods study that evaluated the feasibility and effects of a planned and structured prognosis discussion.,patients;diagnosed with;breast cancer;patients;diagnosed with;advanced breast cancer;effects;feasibility of;planned prognosis discussion;Female patients;diagnosed with;advanced breast cancer;Female patients;diagnosed with;breast cancer;effects;feasibility of;prognosis discussion;,6
Audio analysis of the intervention appointments was conducted to assess intervention feasibility.,analysis;was;conducted;Audio analysis;assess;intervention feasibility;Audio analysis;was;conducted;analysis;assess;intervention feasibility;,4
Patient self-reports of prognosis related beliefs and treatment preferences were compared across intervention and usual care groups.,Patient self-reports;were;compared;Patient self-reports;were compared across;intervention;,2
Most patients found the T-PAT appointment challenging but worthwhile.,Most patients;found;appointment;patients;found;appointment;patients;found;T-PAT appointment;Most patients;found;T-PAT appointment;,4
Intervention uptake by clinicians was good  but some fidelity disruptions were noted.,,0
T-PAT participants were more likely to hold realistic beliefs about disease curability after the appointment.,T-PAT participants;hold beliefs after;appointment;T-PAT participants;hold;realistic beliefs;T-PAT participants;hold;beliefs about disease curability;T-PAT participants;hold;realistic beliefs about disease curability;T-PAT participants;were;likely;T-PAT participants;hold;beliefs;T-PAT participants;were;more likely;,7
